cluster_id,name,description,size,total_size,member_clusters,sample_summaries
0,Filter spam and non-technical solicitations from LangChain support channels,"<summary>Support teams filtered and categorized large volumes of unsolicited marketing spam, SEO solicitations, phishing attempts, and non-technical business inquiries that were incorrectly submitted to LangChain technical support channels. The support process involved systematically identifying, blocking, and removing irrelevant commercial messages to maintain channel integrity for legitimate LangChain technical assistance.",29,415,"[np.int32(0), np.int32(7), np.int32(13), np.int32(14), np.int32(18), np.int32(22), np.int32(25), np.int32(35), np.int32(37), np.int32(70), np.int32(74), np.int32(75), np.int32(89), np.int32(94), np.int32(100), np.int32(108), np.int32(110), np.int32(111), np.int32(116), np.int32(120), np.int32(131), np.int32(143), np.int32(173), np.int32(192), np.int32(200), np.int32(218), np.int32(225), np.int32(239), np.int32(247)]",
1,Resolve comprehensive LangSmith platform technical issues and integration problems,"<summary>
Support teams resolved a comprehensive range of LangSmith platform issues including SDK tracing integration problems, dashboard UI bugs, evaluation system configuration failures, and self-hosted deployment infrastructure challenges. The work encompassed troubleshooting core platform functionality across datasets, experiments, playground, authentication, and model integrations while addressing performance optimization and data management concerns.",72,799,"[np.int32(1), np.int32(8), np.int32(12), np.int32(15), np.int32(21), np.int32(24), np.int32(31), np.int32(32), np.int32(33), np.int32(34), np.int32(45), np.int32(47), np.int32(48), np.int32(49), np.int32(52), np.int32(55), np.int32(57), np.int32(58), np.int32(59), np.int32(65), np.int32(66), np.int32(69), np.int32(72), np.int32(73), np.int32(79), np.int32(85), np.int32(93), np.int32(97), np.int32(99), np.int32(102), np.int32(105), np.int32(114), np.int32(119), np.int32(123), np.int32(124), np.int32(127), np.int32(130), np.int32(139), np.int32(141), np.int32(142), np.int32(144), np.int32(146), np.int32(148), np.int32(149), np.int32(150), np.int32(154), np.int32(155), np.int32(156), np.int32(157), np.int32(160), np.int32(161), np.int32(162), np.int32(169), np.int32(170), np.int32(172), np.int32(174), np.int32(175), np.int32(177), np.int32(178), np.int32(181), np.int32(186), np.int32(188), np.int32(193), np.int32(194), np.int32(198), np.int32(203), np.int32(220), np.int32(231), np.int32(238), np.int32(241), np.int32(244), np.int32(245)]",
2,Resolve LangGraph platform deployment infrastructure and OSS development issues,"<summary>Support teams resolved comprehensive LangGraph platform deployment issues including infrastructure failures, quota limitations, configuration problems, and migration challenges across production environments. They also addressed LangGraph OSS library bugs, Studio UI problems, authentication issues, and provided architectural guidance for multi-agent workflows and enterprise deployments.",46,616,"[np.int32(2), np.int32(4), np.int32(19), np.int32(23), np.int32(28), np.int32(29), np.int32(38), np.int32(43), np.int32(51), np.int32(60), np.int32(63), np.int32(64), np.int32(67), np.int32(76), np.int32(80), np.int32(82), np.int32(86), np.int32(87), np.int32(95), np.int32(98), np.int32(101), np.int32(103), np.int32(113), np.int32(118), np.int32(129), np.int32(132), np.int32(138), np.int32(145), np.int32(147), np.int32(152), np.int32(153), np.int32(165), np.int32(167), np.int32(176), np.int32(190), np.int32(195), np.int32(208), np.int32(211), np.int32(214), np.int32(215), np.int32(219), np.int32(230), np.int32(233), np.int32(237), np.int32(246), np.int32(248)]",
3,"Manage LangSmith and LangGraph administrative operations including billing, compliance, and enterprise account management","<summary>
The support work addressed comprehensive LangSmith and LangGraph administrative operations including account management, billing disputes, subscription cancellations, refund processing, and organizational configuration across multiple deployment environments. Teams handled privacy compliance requests such as GDPR data deletions, security documentation provision, SSO authentication setup, quota limit increases, and enterprise licensing while also managing business partnerships and sales consultations.",81,971,"[np.int32(3), np.int32(6), np.int32(9), np.int32(10), np.int32(11), np.int32(16), np.int32(17), np.int32(20), np.int32(27), np.int32(30), np.int32(39), np.int32(40), np.int32(41), np.int32(42), np.int32(44), np.int32(46), np.int32(50), np.int32(53), np.int32(54), np.int32(56), np.int32(62), np.int32(68), np.int32(77), np.int32(81), np.int32(83), np.int32(88), np.int32(90), np.int32(91), np.int32(92), np.int32(96), np.int32(104), np.int32(107), np.int32(109), np.int32(112), np.int32(115), np.int32(117), np.int32(121), np.int32(122), np.int32(125), np.int32(126), np.int32(133), np.int32(134), np.int32(135), np.int32(136), np.int32(137), np.int32(140), np.int32(151), np.int32(158), np.int32(159), np.int32(166), np.int32(168), np.int32(171), np.int32(180), np.int32(182), np.int32(183), np.int32(187), np.int32(189), np.int32(196), np.int32(197), np.int32(199), np.int32(201), np.int32(202), np.int32(205), np.int32(207), np.int32(209), np.int32(212), np.int32(213), np.int32(216), np.int32(217), np.int32(221), np.int32(222), np.int32(223), np.int32(226), np.int32(227), np.int32(228), np.int32(229), np.int32(235), np.int32(236), np.int32(240), np.int32(243), np.int32(249)]",
4,Resolve cross-platform LangChain ecosystem integration and SDK compatibility issues,"<summary>
The support work involved resolving technical integration issues across the LangChain ecosystem, including LangChain OSS Python and TypeScript SDK compatibility problems, LangSmith Prompt Hub and tracing integration challenges, and LangGraph implementation guidance. Additionally, support addressed cloud provider integrations with AWS Bedrock and Google Gemini, structured output schema compatibility, MCP authentication configuration, and multi-language deployment issues spanning the entire LangChain platform.",22,189,"[np.int32(5), np.int32(26), np.int32(36), np.int32(61), np.int32(71), np.int32(78), np.int32(84), np.int32(106), np.int32(128), np.int32(163), np.int32(164), np.int32(179), np.int32(184), np.int32(185), np.int32(191), np.int32(204), np.int32(206), np.int32(210), np.int32(224), np.int32(232), np.int32(234), np.int32(242)]",
