cluster_id,name,description,size,total_size,member_clusters,sample_summaries
168,Implement LangSmith audit logging for security compliance monitoring,"Users requested comprehensive audit logging and monitoring capabilities in LangSmith to meet security compliance requirements and track API usage, user activity, and anomalous behavior detection. The support requests focused on implementing audit log features for identifying API key usage patterns, tracking user actions on sensitive resources, and providing manual access to log data during security incidents.",6,6,,"['provide a comprehensive audit log feature for security compliance purposes, specifically to address insufficient logging and monitoring by implementing API call logging and anomalous behavior alerts. This was a security requirement that involved designing and implementing an audit system using database audit tools and query logs to track user actions on sensitive resources within the platform.', 'provide a usage report for LangSmith that shows who is using the product, how frequently they use it, and when they last accessed it to help with seat assignments. The support agent explained that audit logging capabilities are not currently available but are planned as an enterprise feature for the next quarter.', 'provide audit logs to identify which API key created abnormal tracing projects that have appeared multiple times in their workspace, as they suspect the projects were created by a script or by mistake by a coworker.']"
169,Resolve Azure OpenAI integration issues with LangSmith Playground and tracing,"Users encountered various configuration and compatibility issues when integrating Azure OpenAI with LangSmith Playground and tracing functionality, including problems with API key setup, deployment settings, model name tagging, and API version compatibility. The support team resolved these issues through configuration adjustments, parameter removal, version updates, and clarification of Azure-specific documentation requirements.",15,15,,"['help them with the LangSmith Playground integration with Azure OpenAI API, specifically resolving configuration issues with API keys, instance names, and deployment settings that were preventing the Playground from working correctly.', 'help with a LangSmith Playground issue where Azure OpenAI deployments were being incorrectly tagged as ""gpt-4o-mini"" instead of the actual deployed model name ""o1-mini"". The support team provided a fix that required removing the ""model"" parameter from the Extra Parameters section in the playground settings, which successfully resolved the model tagging issue.', 'help them with their LangChain/LangSmith support issue related to Azure OpenAI API key configuration problems. The user is experiencing a ""Missing key"" error when using Azure OpenAI through the API, despite the same configuration working fine with regular OpenAI models and on the LangSmith platform.']"
170,Configure LangSmith evaluation and tracing workflows with SDK integration,"Users requested comprehensive guidance on implementing and configuring LangSmith's core features including tracing, evaluation workflows, dataset management, automation rules, and SDK integration across Python and TypeScript environments. They encountered technical issues with run filtering, structured prompt handling, cache serialization, async evaluator configuration, and accessing trace metadata while seeking to establish proper monitoring and evaluation pipelines for their LLM applications.",25,25,,"['provide guidance on prompt engineering across different LLM providers and information about DSPy integration with LangChain, along with scheduling a follow-up discussion about prompt optimization features in the playground.', ""help them set up a LangSmith evaluator for their PDF data extraction workflow, specifically troubleshooting a TypeError related to the 'split' method and understanding how to properly configure the evaluation pipeline with their dataset."", 'help them understand how to prevent LangSmith from interpreting curly braces `{}` as variables in prompts when using a proprietary language where those brackets have specific meaning, which was preventing them from running prompts in the playground over their dataset.']"
171,Resolve LangGraph and LangSmith license verification and authentication issues,"Users encountered license verification errors and authentication issues in LangGraph and LangSmith, including failed license key validation after server rebuilds and expired API keys. Support requests involved obtaining new license keys, renewing expired credits, checking license expiration status, and resolving contract-related licensing problems.",6,6,,"['help with a license verification error that occurred after rebuilding their self-hosted LangGraph server, which was previously working but started failing with authentication configuration issues.', 'provide a new license key link for LangSmith, as the previous link they received via email had expired while they were out of office.', 'help with a LangGraph Platform license verification error that occurs when trying to use their API key on the free plan, despite having generated the key successfully.']"
172,Troubleshoot LangSmith tracing reliability and dashboard visibility issues,"Users experienced various LangSmith tracing and observability reliability issues where runs, traces, and experiment data were inconsistently appearing in the dashboard despite successful application execution. These issues manifested across different environments including production deployments, batch processing operations, and evaluation workflows, often requiring debugging steps, SDK upgrades, or backend incident resolution to restore proper trace ingestion and visibility.",16,16,,"['help with a LangSmith testing tutorial issue where pytest with the --output=ls flag shows ""no tests ran"" in the terminal despite tests running successfully and appearing in LangSmith traces.', 'help them with a caching error in their evaluation setup when using the test cache environment variable, which causes streaming response content access errors that only occur when caching is enabled. The support team identified this as a known thread safety issue with the caching library and provided workarounds including using LLM caching or disabling concurrency.', ""help with a LangSmith evaluation backfill feature that wasn't properly applying filters when checking record counts, causing errors even when filtered results showed only a few traces, and later experiencing internal server errors and preview functionality issues after an attempted fix was deployed.""]"
173,Handle unsolicited spam and non-technical business inquiries,"Users sent
unsolicited business inquiries including investment proposals, fuel commodity
sales, SEO services, affiliate marketing partnerships, and fraudulent document
signing requests to LangChain support channels. The support team consistently
declined these non-technical spam communications and provided appropriate
security guidance where needed.",19,19,,"['categorize a support interaction, but the conversation itself shows an external company reaching out with an unsolicited promotional offer for an affiliate marketing partnership, which was declined by the team.', 'categorize a support interaction where someone sent an unsolicited investment proposal email to the company, which was politely declined as spam/non-technical inquiry.', 'categorize a conversation that was actually unsolicited SEO marketing spam, not a legitimate support request. The company politely declined the SEO services offer.']"
174,Resolve LangSmith Playground model integration and interface errors,"The support requests focused on resolving various LangSmith Playground integration issues with different AI models (Claude Sonnet, DeepSeek on Azure, Sonnet 3.5) and addressing technical errors in the web interface including JavaScript errors and validation problems. Additional requests involved troubleshooting ReACT agent implementations with LangChain libraries, annotation queue functionality problems, and general model configuration guidance for Vertex AI integrations.",7,7,,"[""help them with a technical issue involving a ReACT agent using Claude Sonnet and LangChain libraries, specifically an error with the trim_messages function and Anthropic's API that requires valid message sequences and tool definitions."", 'help them with an issue they\'re experiencing with their annotation queues in LangSmith, where they\'re getting a JavaScript error (""t.flatMap is not a function"") when trying to access their annotation queues through the web interface.', 'help them with a technical issue in LangSmith where the cached token count display for Sonnet 3.7 was broken and inconsistently showing ""time to first token"" metrics, with values changing unexpectedly between page refreshes. The issue was eventually resolved after a system revert was implemented.']"
175,Troubleshoot LangSmith dataset SDK integration and API workflow issues,"Users encountered various technical challenges when working with LangSmith datasets programmatically through SDKs and APIs, including authentication errors, API endpoint configuration issues, and dataset existence checking methods. They also faced difficulties with dataset integration workflows such as bulk testing, data preprocessing, custom evaluator setup, and handling complex data types like vision pipelines with base64-encoded images.",10,10,,"['help them find a method in the SDK to check if a dataset exists by name. The support agent provided the solution by directing them to use the has_dataset() method.', 'add a pre-processing step for data redaction when creating or adding new elements to a Dataset from the UI, specifically wanting to trigger an internal redaction service before data gets stored in the Dataset.', 'understand how to execute bulk data against workflows running on a server through the studio interface, as the current system only allows testing individual objects one at a time rather than entire datasets. The support team indicated they are actively developing this feature and offered to enable it behind a feature flag for early access and feedback.']"
176,Resolve LangGraph platform deployment failures and infrastructure configuration issues,"Users experienced deployment failures, infrastructure issues, and configuration problems on the LangGraph platform, including database connection errors, empty build logs, SSL configuration issues, and deployment availability problems. Support teams resolved these issues through environment variable corrections, database URI formatting fixes, resource redeployment, infrastructure repairs, and proper IAM role configuration.",20,20,,"[""help them with their deployment issues on the platform, specifically that their deployment was working yesterday but today there are no logs, they can't access the docs, and new revisions are not being deployed."", ""help with a greenlet package error that was affecting their app builds, though the issue was ultimately resolved by updating the CLI and the team clarified they don't use greenlet in their stack."", ""help them access the API service key for their deployed agent on the platform, as they can only delete but not view the key, which is preventing them from using the deployment for their healthcare startup's business needs.""]"
177,Fix LangSmith Playground multimodal bugs and UI improvements,"Users reported multiple bugs and feature requests related to LangSmith Playground's multimodal capabilities, including incorrect token calculation for uploaded images (counting ~100,000 tokens instead of ~100), context length errors with image uploads, and issues with dynamic image attachments in prompt templates. They also provided feedback on various UI/UX improvements needed for the playground, such as better model switching functionality, prompt text diff visualization, layout optimization, automatic template updates, and enhanced collaboration features like version comparison and branching capabilities.",13,13,,"['help them with a bug report about incorrect token calculation for image prompts in the playground and SDK, where uploaded images are counted as approximately 100,000 tokens based on their base64 string instead of the correct ~100 tokens when using image URLs.', ""help them with a bug in the playground environment where they're getting context length exceeded errors when uploading images and prompts, even though the same content works fine in the native playground, and they're also experiencing inconsistent image rendering and different model responses compared to direct API usage."", ""help them configure prompt templates for multimodal evaluations in the playground, specifically how to include dynamic image attachments from dataset examples when running experiments. After troubleshooting revealed that attachment placeholders weren't working in the playground interface, they ultimately resolved their needs by using the SDK instead.""]"
178,Enable and configure LangSmith bulk data export functionality,"Users requested support for enabling and configuring LangSmith's bulk data export feature across various deployment scenarios including SaaS Plus plans, self-hosted environments, and multi-region setups. Support agents addressed feature enablement, API authentication errors, rate limiting issues, regional endpoint configuration, and provided guidance on proper usage of the bulk export functionality for offline data analysis.",9,9,,"[""enable the Bulk Data Export feature for their organization's Plus plan account, which allows them to export data for offline analysis. The support agent successfully enabled this feature for their organization and provided instructions on how to use it."", 'help with bulk export functionality in self-hosted LangSmith, specifically needing guidance on proper configuration including workspace ID setup to successfully export data.', 'help them understand how to export all data from their LangSmith tracing project. The support agent provided two main options: using the bulk export feature (available on the Plus plan) or utilizing the Python API with the list_runs method.']"
179,Clarify LangChain TypeScript SDK structured output and image formatting,Users requested clarification on the withStructuredOutput function's method property values and defaults in the LangChain TypeScript SDK. They also needed guidance on the proper format for including images in message list input variables when using the LangSmith TypeScript SDK.,2,2,,"['provide information about the possible values for the method property in the `withStructuredOutput` function in TypeScript, specifically asking about allowed values and defaults for the generation type parameter.', 'provide information about how to add images to the ""messages list"" input variable type in the LangSmith TypeScript SDK, as there was no UI option available and they needed the proper format for including images alongside text messages.']"
180,Resolve LangSmith billing and invoice management issues,"Users contacted support to resolve various LangSmith billing and account management issues including invoice delivery problems, incorrect charges, duplicate payments, and payment method consolidation. The support team addressed these requests by resending invoices to correct email addresses, processing refunds for overcharges and duplicate subscriptions, adjusting billing for correct user counts, and helping consolidate accounts across multiple organizations.",14,14,,"['help them understand the process for purchasing multiple tickets for an event, specifically asking about group ordering options and ticket transferability.', 'help them with their billing and invoice delivery issues. The user needed invoices to be resent to a different email address than where they were originally being delivered.', 'help them with a billing issue where they were being charged for 3 seats when they only had 2 active users, requesting both a refund for past overcharges and adjustment of future billing. The support team initially provided a partial credit but the user pushed for additional retroactive refunds, ultimately receiving credits covering 5 months of overcharges.']"
181,Diagnose LangSmith tracing latency and performance optimization issues,"Users sought support for understanding and resolving performance bottlenecks in LangSmith tracing, particularly around latency metrics calculation methodology, slow Thread tab loading, and excessive database queries to checkpointers during streaming operations. They also requested guidance on profiling tools for production environments, batch evaluation optimization to avoid rate limiting, and clarification on latency color indicators in the tracing interface.",7,7,,"['provide clarification on how latency metrics (P50 and P99) are calculated in the thread view for tracing, specifically asking about the methodology behind these percentile calculations.', 'investigate and resolve slow loading performance issues with the Thread tab in their tracing project, specifically when using full document Q&A functionality rather than chunk-based RAG.', 'help with a database configuration issue in their staging environment that was causing latency problems with queue services, which was ultimately resolved by running missing migration scripts to add required database columns.']"
182,Provide LangSmith project management and organization setup guidance,"Users requested guidance on LangSmith project management best practices including dependency version management, collaborative development workflows, and version control organization. They also sought account administration support for upgrading to Plus plans with centralized organization access and requested SDK enhancements for custom project URL patterns and ID configuration.",4,4,,"['provide guidance on best practices for managing dependency versions in their project, specifically which dependencies should have flexible versus pinned versions after resolving an initial constraint issue with the SDK.', 'upgrade from Developer to Plus plan and set up a centralized organization account that allows multiple team members to access existing work previously created under a personal account.', 'provide guidance on setting up a community-driven project structure for collaborative development workflows, including best practices for organizing projects in version control, sandboxing chains for safe testing, collaborative editing tools, and API key management in public contributor environments.']"
183,Resolve LangSmith account administration and billing access issues,"Users experienced various administrative issues with their LangSmith accounts including billing payment setup problems, organization access issues due to SSO configurations, and password reset failures for accounts created with OAuth providers. The support team resolved these issues by identifying authentication method conflicts, escalating billing system bugs to engineering, and helping users navigate account recovery processes.",17,17,,"['help them access a LangSmith account that belonged to a former employee who is no longer with the company, so they can download usage receipts and transition the account to their own email address. The issue was resolved when the support agent removed the email from the bounce/suppression list, allowing password reset emails to be delivered successfully.', 'help with a billing details update issue in the platform where required fields for city and postal code are showing as missing despite being filled in. The support team identified this as a known issue affecting countries without postal codes and escalated it to engineering for investigation.', 'help them understand what happened to their organization that had disappeared from their accounts and why they lost access to their traces. The issue was resolved when the support agent identified that the organization had switched to SSO-only logins and the user needed to use the SSO URL to access their organization.']"
184,Resolve LangChain OSS Python structured output schema compatibility issues,"Users experienced multiple compatibility issues between LangChain OSS Python's structured output functionality and various model integrations, including schema validation failures with Pydantic models, recursive schema dereferencing problems, and integration bugs with OpenAI Responses API and other providers. The requests also included feature requests for runtime schema customization and troubleshooting guidance for structured output implementations across different model backends.",17,17,,"['help with a technical issue involving the integration of a specific language model (Claude 4) with a chat interface component in the LangChain Python library, which was causing tool invocation errors that were later resolved by upgrading library versions, followed by additional test failures related to stream handling that required polyfill adjustments.', 'remove the response limit on the Claude 3.5 Haiku model on the chat platform, as it truncates lengthy code responses and stops providing complete output for complex queries.', 'help with structured output functionality using the perplexity integration in the Python library, specifically troubleshooting issues with non-trivial cases and nested structures not working reliably.']"
185,Acknowledge positive feedback on new LangChain platform features,"Users provided positive feedback about recently implemented LangChain/LangSmith features including memory interrupts functionality, a new waterfall view feature, and a new button feature. These requests represented user satisfaction and appreciation for platform enhancements rather than technical support needs.",3,3,,"['provide positive feedback about the memory interrupts feature, expressing satisfaction with this functionality.', 'provide positive feedback on a new waterfall view feature that was recently added, expressing appreciation for the enhancement.', 'provide positive feedback on a new button feature. This is not a support request but rather positive feedback expressing satisfaction with a recently implemented feature.']"
186,Add waterfall visualization support to LangSmith thread view interface,"Users requested the addition of waterfall view functionality within LangSmith's thread view interface to enable latency analysis at the turn level, similar to the waterfall visualization available in regular trace views. They also sought improved navigation between thread view and waterfall view interfaces to streamline workflow when analyzing trace performance.",2,2,,"['provide a feature request for waterfall view support within the thread view functionality in LangSmith, specifically wanting to see waterfall visualization at the turn level similar to how it appears in regular trace views outside of the threads tab.', 'provide a way to view waterfalls from the thread view for latency analysis, or at least improve navigation between thread view and waterfall view in the interface.']"
187,Coordinate general business meeting scheduling and calendar management,"Users requested assistance with scheduling and rescheduling general business meetings during specific time periods and resolving calendar coordination conflicts. These requests involved meeting logistics coordination rather than technical support for LangChain, LangSmith, or LangGraph platform services.",3,3,,"['schedule a meeting during US hours on Friday. The assistant responded by sending a meeting invite for that time slot.', 'reschedule a February check-in meeting from February 6th-11th to February 3rd due to being on break, and to update the corresponding Google calendar invite.', 'reschedule a monthly check-in meeting due to a scheduling conflict with a team all-hands meeting. This is not a LangChain/LangSmith support request but rather a general meeting coordination request.']"
188,Resolve LangSmith Playground interface functionality and system errors,"Users experienced various functional issues with the LangSmith Playground interface including broken edit buttons, missing functionality for tool execution and audio transcription testing, and system errors during prompt iteration and execution. These support requests involved troubleshooting playground-specific features like structured output display, multimodal input processing, template formatting, rate limiting configuration, and UI bugs that prevented normal prompt development workflows.",17,17,,"['resolve multiple LangSmith Playground system degradation issues including real-time output preview failures during experiments, random extra parameters being populated causing JSON parsing errors, and incomplete prompt saving when committing changes.', 'help them understand how to trigger a custom retrieval tool directly from the LangSmith Playground interface, rather than having to invoke it through an external process. The support team confirmed that arbitrary tool execution is not currently supported in the playground.', 'update the default template format for their organization to mustache instead of fstring in the playground, as fstring incorrectly interprets their few-shot examples in JSON as variables.']"
