cluster_id,name,description,size,total_size,member_clusters,sample_summaries
63,Resolve LangGraph development and deployment dependency conflicts,"Users experienced various technical errors and dependency conflicts during LangGraph development and deployment processes, including C++ errors with langgraph dev, ModuleNotFoundError issues, ImportError problems, and build failures caused by missing dependencies or version incompatibilities. The support team resolved these issues through package updates, dependency fixes, environment configuration changes, and providing proper setup guidance for both local development and platform deployment workflows.",20,20,,"['help with a ModuleNotFoundError when trying to import ToolNode from langgraph.prebuilt in LangGraph version 0.3.4, which was preventing them from building their LLM agent. The issue was resolved by creating a new virtual environment and reinstalling langgraph.', 'add `.langgraph_api` to the `.gitignore` file in template projects, which is a development configuration improvement for LangGraph OSS Python projects.', ""help resolve an ImportError in the langgraph package where 'CONFIG_KEY_THREAD_ID' cannot be imported from 'langgraph.constants', which is blocking their software releases. The support team provided a fix by releasing an updated version that maintains backward compatibility with older langgraph versions.""]"
64,Resolve LangGraph platform legacy infrastructure migration requirements,"Users received notifications that their LangGraph platform deployments were running on deprecated legacy infrastructure and required manual intervention to create new revisions before specified deadlines to avoid permanent project deletion. The requests focused on understanding the migration process, using custom Dockerfiles with deployment commands, API availability for CI/CD automation, and troubleshooting deployment behavior issues during the infrastructure transition.",15,15,,"['help them understand the content of a support message they received about a LangGraph deployment migration issue. The user needs to create a new revision of their deployment to migrate from deprecated legacy infrastructure to new infrastructure before a specified deadline to avoid permanent project deletion.', 'help them understand the LangGraph deployment migration issue they received, which requires manual intervention to create a new revision due to a failed auto-migration from legacy infrastructure.', 'help them understand the LangGraph deployment migration issue they received notification about, which requires manual intervention to create a new revision due to failed auto-migration from legacy infrastructure.']"
65,Recover deleted LangSmith support conversation content for analysis,"Users attempted to access various LangChain/LangSmith support conversations and resources for analysis and categorization purposes. However, the actual conversation content and technical details were deleted or unavailable, preventing determination of the specific support requests except for one case involving a JSONL dataset upload error in LangSmith.",13,13,,"['provide a summary of the conversation, but the conversation content was deleted so no specific support request can be determined.', 'provide a response to a conversation that was deleted. The conversation appears to be about a Slack thread that is no longer available.', 'provide a response to a message that was deleted.']"
66,Resolve LangSmith LLM-as-Judge evaluation system technical issues,"Users experienced multiple technical issues with LangSmith's LLM-as-a-Judge evaluation system, including problems with evaluation scores not displaying in reports, evaluators not triggering despite proper configuration, incorrect variable mapping causing inaccurate scoring, and UI sorting bugs when filtering experiment results. They also sought guidance on best practices for implementing LLM-as-Judge evaluations, accessing conversational history in evaluators, and incorporating human feedback alongside automated evaluation metrics.",13,13,,"[""help them with a UI issue in LangSmith where sorting experiment results by judge score doesn't work properly when text search filters are applied, causing results to appear out of order."", 'help them with a bug in the evaluation report display for LLM-as-a-judge in LangSmith, where evaluation scores are not displaying in the evaluation report interface despite being logged in traces, which is impacting their ability to efficiently evaluate and improve their system prompts.', 'help with LangSmith online evaluations and rules, specifically seeking ways to access the last message in complex traces for LLM-as-judge evaluations and how to reference trace metadata in handlebars templates for evaluation rules.']"
67,Resolve LangGraph Platform critical infrastructure outages and service errors,"Users experienced critical production outages on LangGraph Platform with persistent HTTP 503 and 502 errors, DNS failures, and service unavailability issues that completely halted their AI workflows and agent systems. The support team resolved these infrastructure-level problems by fixing DNS configurations, addressing database connectivity issues, implementing environment variable solutions for blocked event loops, and providing guidance on static IP configurations and retry strategies.",11,11,,"['help resolve recurring 503 Service Temporarily Unavailable errors with LangSmith Run Ingestion that are completely halting their production AI workflows and LangGraph-based agents. The user is seeking clarification on whether this is a known service issue, rate limiting problems, or backend instabilities, and requesting guidance on retry strategies while their production system remains affected.', 'help with a LangGraph Cloud agent run that is stuck in an indefinite execution state with invalid negative timing values, cannot be stopped via API due to internal server errors, and is causing unnecessary costs to accumulate.', 'help them with a LangGraph Platform issue where their hosted agent was experiencing 500 errors and thread creation failures after a cloud outage, which was ultimately resolved by rolling back a recent deployment that introduced custom authentication middleware.']"
68,Migrate LangSmith accounts from US to EU region,"Users requested assistance with migrating their LangSmith accounts from the US region to the EU region for data residency and compliance requirements. The support team provided guidance on the manual migration process involving creating new EU accounts, exporting and importing data using the SDK, transferring subscriptions and startup discounts, and handling billing transitions during the regional switch.",16,16,,"['help them migrate their organization and users from the US data region to the EU data region, including transferring their paid subscription credits to the new EU account.', 'help them migrate their LangSmith account from the US region to the EU region while maintaining their startup plan discount and ensuring no service interruption for their current clients. The support team worked out a solution to approve the startup plan on both accounts temporarily during the migration process.', 'change their account zone from US to EU for their startup account, seeking guidance on whether this is important and how to accomplish the migration for compliance reasons.']"
69,Resolve LangSmith dashboard API integration and UI functionality issues,"Users encountered multiple LangSmith dashboard functionality issues including API documentation gaps for programmatic chart creation, 422 errors when updating charts due to missing required fields, and problems with adding metrics/evaluators as columns in experiment views. Additionally, users reported UI/UX problems such as missing ToolMessage artifact fields, navigation difficulties between experiment rows and traces, crashes from malformed data uploads, and incorrect token statistics display in the threads table.",7,7,,"['provide API documentation for creating dashboard sections and charts. The support agent responded by directing them to the REST API documentation for programmatically creating charts and dashboards.', ""resolve two LangSmith dashboard issues: inability to add metrics and evaluators as columns in the experiment view, and missing ToolMessage artifact fields in the UI that don't appear even in JSON or raw mode."", ""help with LangSmith API issues, specifically encountering 422 errors when updating charts due to missing required fields not documented in the API documentation, and later having problems creating charts with session filters that weren't matching project IDs correctly.""]"
70,Categorize unsolicited marketing and SEO service spam emails,"The support team received multiple unsolicited marketing emails offering various services including SEO, website optimization, guest posting, trademark services, blockchain promotions, and domain ownership inquiries. These spam messages were appropriately identified and declined by the support team as they were unrelated to any legitimate LangChain or LangSmith technical support needs.",13,13,,"['help categorize a spam inquiry about domain ownership that is unrelated to any technical support needs.', 'categorize a spam email that was sent to the support team offering unsolicited SEO and guest posting services, which the support team appropriately declined according to their standard policy.', 'categorize a spam email that was sent to the company and declined by the support team. This falls under the ""Spam"" category as it was an unsolicited marketing email from an external web development company that was rejected.']"
71,Resolve LangSmith Prompt Hub integration and performance issues,"Users encountered multiple issues with LangSmith Prompt Hub integration and performance, including third-party model provider failures due to empty content blocks, JSON serialization errors in JavaScript environments, and extremely slow prompt retrieval times exceeding 20 minutes in TypeScript. They also requested enhanced functionality for caching prompt configurations, syncing prompts to internal databases, and pulling complete prompt configurations with associated models and tools from the hub.",7,7,,"['help with a production issue where their integration between a third-party language model provider and the framework was failing due to empty content blocks in their prompt template, which was causing API errors and degrading their production deployment.', 'help with an error when using model configurations from the prompt hub with the chat model library in a javascript environment. The user wanted to configure model parameters centrally and switch between different model providers easily without hardcoding model classes in their application code.', 'sync prompts in the prompt hub to an internal database, specifically wanting their own database to be the source that the platform reads and writes from rather than depending on prompts at runtime.']"
72,Enhance LangSmith data masking and LangGraph Platform security features,"Users requested enhancements to LangSmith and LangGraph Platform data security and privacy features, specifically for masking sensitive information in traces without corrupting application data and implementing data isolation mechanisms. The support requests focused on resolving technical issues with current masking implementations that were mutating original data objects, improving performance of encryption operations, and adding write-only API permissions and brand-specific data encryption capabilities.",7,7,,"[""help with a technical issue related to state conversion to datasets in LangSmith, specifically the clunkiness when defining target functions and evaluators due to input/reference output objects being converted to dictionaries. The user is seeking a smoother solution for handling object access differences between process output (.content) and reference output (['content']) formats."", 'provide a middleware feature for data isolation in LangGraph Platform that would allow automatic encryption and decryption of customer data using brand-specific keys before and after all reads and writes to storage systems including traces, checkpointer state, and memory stores. The user needs this platform-level solution to ensure compliance with data privacy policies for multiple brands using their LangGraph-based platform.', 'help with masking sensitive information in LangSmith during tree runs, where the current implementation using hideInputs and hideOutputs is mutating the original data objects instead of creating copies, causing masked values to be used in subsequent LLM calls rather than the actual data needed for processing.']"
73,Resolve complex LangSmith SDK tracing integration and customization issues,"Users experienced complex LangSmith tracing integration challenges involving SDK configuration with third-party tools like Vercel AI SDK, OpenTelemetry compatibility issues, and problems with trace completeness when capturing images, tool outputs, and metadata. They also encountered difficulties with advanced tracing features including dynamic project routing, multi-provider trace consolidation, persistent tool state management, and customizing trace display elements in the LangSmith UI.",19,19,,"['help with LangSmith SDK tracing integration, specifically resolving issues with creating runs via API calls and learning how to create new projects and specify project parameters in API requests.', 'dynamically specify which LangSmith project to send traces to during LLM invocation, rather than using static environment variables, in order to separate automated test traces from human-generated traces.', 'resolve issues with LangSmith tracing when using the AISDKExporter with the Vercel AI SDK, specifically missing text content in tool calling outputs and missing base64 encoded images in trace runs.']"
74,Handle non-technical business inquiries and spam messages,"The requests were primarily business development inquiries, spam messages, and unsolicited marketing outreach unrelated to LangChain technical support, including partnership proposals from AI marketplaces, domain sales, and promotional service offers. The only legitimate support requests involved clarifying community Slack eligibility requirements and seeking developer referrals for LangChain integration projects.",11,11,,"['clarify eligibility requirements for joining the community slack channel and accessing support for their AI application development project. They specifically needed guidance on whether a registered business is required or if being a sole trader is sufficient to join the community and get help with their development work.', 'provide a referral to hire a developer who can integrate GPT with LangChain, Eleven Labs, and D-ID to create a virtual assistant with memory for answering client questions about real estate properties.', 'provide a sales inquiry from an AI software agency offering engineering services to help scale development while keeping costs efficient. The support team acknowledged receipt and indicated they would respond within one business day.']"
75,Handle unsolicited partnership and business development inquiries,"Users submitted multiple unsolicited business development inquiries seeking partnerships, distribution opportunities, investment discussions, and collaboration arrangements with the LangChain team. These requests were declined or redirected as they involved sales and business development matters rather than technical support for LangChain products.",16,16,,"['provide a business partnership proposal for distribution services in a specific Asian market, which falls under sales/business development rather than technical support.', 'provide product catalog information, minimum order quantities, delivery terms, and payment terms for establishing a business relationship. This appears to be a sales inquiry that was misrouted to technical support.', 'follow up on a collaboration opportunity with a marketplace platform, providing contact information and scheduling options for further discussion about potential partnership.']"
76,Resolve LangGraph Studio setup and access configuration issues,"Users experienced various technical issues with LangGraph Studio application setup, configuration, and access including 403 authentication errors, JavaScript runtime errors, reverse proxy configuration problems, and ingress setup failures. The support requests focused on troubleshooting Studio connectivity problems, resolving application loading errors, and providing guidance on proper Studio deployment and authentication methods.",8,8,,"['help with 403 errors encountered when creating a developer account using authentication and accessing workspace features. The support agent provided troubleshooting steps including clearing cache, trying different browsers, alternative authentication methods, and requesting diagnostic information.', ""get help with setup and configuration errors they're encountering while trying to use the studio application and various project templates. The support agent requested specific error details, screenshots, and reproduction steps to help troubleshoot the issues."", 'help with configuring a reverse proxy to access the Studio web interface through their server infrastructure, and understanding how Studio communicates with their local development server in a secure environment.']"
77,Report security vulnerabilities and inquire about bug bounty program,"Multiple security researchers and vulnerability testers contacted support to report various security vulnerabilities they discovered on the website and platform infrastructure. They sought information about the bug bounty program coverage, compensation rates, responsible disclosure procedures, and proper reporting channels for different components of the LangChain ecosystem.",10,10,,"['inquire about bug bounty rewards for reporting security vulnerabilities they discovered on the website, and to understand which domains and repositories are eligible for the bug bounty program.', 'provide a security vulnerability disclosure report regarding a critical denial-of-service vulnerability on the forgot password endpoint due to lack of rate limiting. This falls under Admin Support in the Security, Privacy and Compliance category as it involves a security disclosure about potential application-level DOS attacks.', 'report potential security vulnerabilities they discovered and inquire about the bug bounty program. The support team provided information about the vulnerability disclosure process and bug bounty program coverage for specific open-source repositories.']"
78,Assist with LangGraph implementation guidance and LangSmith programmatic configuration,"Users sought assistance with diverse LangGraph and LangSmith implementation questions including customer confirmation handling, programmatic schema and prompt management, node population best practices, and custom metric tracking on dashboards. The requests also included sales inquiries for enterprise adoption and conference access, along with general product consultation needs.",7,7,,"['help them understand how to implement customer confirmation handling in LangGraph, specifically whether customers can directly approve actions rather than having only the agent or admin handle confirmations. They also reported technical difficulties joining the community platform.', 'help them find candidates for their hiring process through a professional networking platform using an AI agent, and they want to schedule a video meeting to discuss this.', 'help them understand what they wish to achieve via app, so that they can analyze the same and provide them the best solution accordingly.']"
79,Resolve self-hosted LangSmith infrastructure and API configuration issues,"Users experienced various infrastructure and configuration issues with their self-hosted LangSmith deployments, including API endpoint routing problems, database storage failures, and networking configuration errors. These issues were resolved through infrastructure scaling, environment variable corrections, storage expansion, and proper API endpoint configuration for their custom deployment environments.",12,12,,"['help with an issue accessing the OpenTelemetry endpoint in their LangSmith API deployment, which was resolved by upgrading their helm chart version to enable the correct API routing configuration.', 'help with a self-hosted LangSmith setup issue where inputs and outputs were not displaying properly in the UI due to incorrect presigned URL configuration pointing to localhost instead of the proper S3 endpoints, along with intermittent 504 gateway timeout errors that were resolved by scaling platform-backend replicas and adjusting environment variables.', 'help with a LangSmith data export issue where they were unable to create an AWS S3 destination due to a JSON formatting error in the API request, which was resolved by removing a trailing comma from the configuration.']"
80,Troubleshoot LangGraph platform deployment operational and infrastructure issues,"Users experienced various operational and infrastructure issues with their active LangGraph platform deployments, including server timeouts, authentication failures, DNS problems, and unexpected deployment deletions. The support team helped troubleshoot these production reliability issues by identifying root causes like database overload, cloud provider outages, and configuration problems affecting live deployments.",30,30,,"['help them with a database connectivity issue in their self-hosted LangGraph deployment, specifically related to PostgreSQL connection limits and performance problems that were causing errors under load.', ""help them understand why they received a deletion notice for their LangGraph Platform deployment despite active usage, which was ultimately resolved by identifying that a committed .env file with an API key was interfering with the platform's usage tracking system."", 'help with LangGraph platform deployment configuration, specifically resolving storage class issues for postgres volumes and ingress/routing problems in their kubernetes environment. The conversation involved troubleshooting pod scheduling issues, configuring helm chart values, debugging deployment validation failures, and ultimately implementing gateway API support instead of traditional ingress.']"
81,Refund unexpected LangSmith Extended Data Retention billing charges,"Users requested refunds for unexpected billing charges related to Extended Data Retention upgrades in LangSmith that were automatically enabled or accidentally left on, resulting in charges ranging from hundreds to thousands of dollars beyond their normal usage costs. Support teams consistently provided one-time courtesy refunds and guidance on configuring spend limits to prevent future unintended extended data retention charges.",24,24,,"['investigate and explain an unexpected $330 billing charge on their account related to extended data retention settings, and to request a possible refund. The support agent successfully processed a one-time courtesy refund after determining the charge was likely caused by existing traces being switched to extended data retention unexpectedly.', 'investigate a billing discrepancy for their November-December invoice, which was significantly higher than previous months and inconsistent with their expected usage patterns. The support team identified that the high charges were caused by a large volume of traces flowing into projects with extended data retention, potentially due to error traces from an access problem.', 'help them with a billing issue related to unintended charges for Extended Data Retention Upgrades in LangSmith, requesting refunds for unexpected fees totaling over $300 and guidance on preventing future charges.']"
82,Resolve LangGraph Platform production infrastructure and scaling issues,"Users experienced various infrastructure and deployment issues with LangGraph Platform production environments, including health check failures, container scaling limitations, disk utilization problems, and performance inconsistencies. They requested technical assistance with resource allocation, autoscaling configuration, Docker setup, database connectivity, and self-hosted deployment troubleshooting.",23,23,,"['help them with a 500 server error when trying to upload a large dataset (19k examples) via the API, which was determined to be a bug with bulk uploads that could be worked around by uploading in smaller batches.', 'categorize a support interaction where a development deployment exceeded disk utilization limits and required infrastructure scaling assistance.', ""help them with missing usage data for their production environment from a specific date range, which they need to complete cost estimation under new pricing. They are following up on an earlier inquiry that hadn't received updates and need assistance retrieving nodes executed data and understanding why this information isn't showing up in their dashboard.""]"
