cluster_id,name,description,size,total_size,member_clusters,sample_summaries
125,Process LangSmith subscription cancellations and billing refunds,"Users requested LangSmith subscription cancellations, often due to forgotten active subscriptions, company policy changes, or misunderstandings about pricing structure. The support team processed these billing cancellations and provided courtesy refunds for unused services when appropriate.",28,28,,"['provide a refund for their subscription payment after cancelling their unused service, having forgotten to unsubscribe after testing. The support team approved a one-time courtesy refund for two billing cycles due to no usage activity.', 'help with a refund for a subscription they canceled on the same day they subscribed, remove their credit card from the account, and delete/cancel their account entirely since they no longer wish to use the service.', 'cancel their subscription effective 2/28/2025 due to a cancelled credit card and internal company restructuring. The support agent confirmed the cancellation request and updated the subscription status accordingly.']"
126,Manage LangSmith account settings and organization configuration,"Users requested assistance with various LangSmith account management tasks including changing email addresses, updating organization names, increasing account limits, and merging experiments across different accounts. These requests involved account configuration changes and administrative modifications rather than complete account deletions or data removal.",9,9,,"[""change their email address in their account settings, but they encountered a bug where the system isn't sending the required confirmation email to complete the email change process."", 'change their account sign-in email address. The support team provided instructions to access account settings through the user avatar dialog to edit the email address using a pencil icon.', 'increase their account limit. The user offered to provide their organization ID if needed, and the support agent handled the request promptly.']"
127,Resolve LangSmith tracing capture and display issues,"Users experienced various issues with LangSmith tracing functionality including traces not being properly captured, missing traces in production environments, and traces not being associated correctly with their parent runs. The requests also involved problems with trace limits not being reflected in the API, account disabling due to abnormal tracing patterns, and UI issues such as difficulty accessing trace details and poor visual highlighting of selected traces.",15,15,,"['resolve an issue where increased tracing limits in their account are not being reflected in the API, preventing traces from passing through despite raising both total trace limits and extended trace limits. Additionally, the user inquired about pricing differences between total traces versus extended traces and asked about future integration plans with a specific search service platform.', 'improve the visual highlighting of selected traces in the interface, as the current selection indicator is too subtle and difficult to locate when scrolling through long lists.', 'help them understand what happened with their account being disabled due to abnormal tracing usage patterns, specifically a single trace with 78 million runs that was impacting system availability. The user needed assistance identifying which project caused the issue and getting their account re-enabled while resolving the underlying tracing problem.']"
128,Configure MCP integration and advanced LangGraph agent features,"Users requested support for integrating and configuring Model Context Protocol (MCP) servers with LangGraph agents, addressing issues with adapter usage, tool management, session handling, and server connectivity. They also sought guidance on implementing advanced LangGraph features like conditional tool access, remote agent initialization, and chat history persistence within their agent architectures.",8,8,,"['inquire about LangGraph support for MCP sampling functionality and to discuss their experimental implementation of hierarchical tool calling using sampling requests within MCP servers.', 'provide guidance on properly using the MCP adapter with a LangGraph server agent, specifically addressing issues with process proliferation and context management when integrating MCP servers into their agent architecture.', ""help with integrating MCP servers using SSE into LangChain agents, specifically requesting support for resource templates as callable tools, runtime resource fetching, error handling for server unavailability, and tool annotations to differentiate between read-only and destructive operations. The conversation resulted in the development team implementing annotation support in the langchain-mcp-adapters library to meet the user's access control requirements.""]"
129,Provide LangGraph Platform enterprise deployment and self-hosting guidance,"Users requested comprehensive information about LangGraph Platform enterprise deployment options, including self-hosted infrastructure requirements, licensing models, pricing structures, and deployment configurations for production environments. The support requests focused on understanding enterprise-tier features like self-hosted data planes, custom domain configuration, compliance requirements, and the transition from managed platform services to on-premises deployments.",19,19,,"['provide additional deployments on the platform and obtain a license key for self-hosting on cloud infrastructure, after experiencing production deployment failures that required rollback to a different system.', 'provide clarification on pricing structures for various products, data security and compliance information, and specific details about using the studio tool with open source implementations. The support interaction involved multiple questions about enterprise pricing, data handling policies, and whether certain tools could be used independently without platform dependencies.', 'help them understand the requirements for upgrading their self-hosted version to v0.9.3, specifically asking about network egress requirements and license key updates needed for the upgrade process.']"
130,Resolve LangSmith self-hosted member invitation and authentication issues,"Users experienced various technical issues with member invitation functionality in their self-hosted LangSmith deployments, including problems with email delivery configuration, HTTP 500 errors during invite acceptance, and authentication restrictions preventing invited users from logging in. These issues were typically resolved through version upgrades from older LangSmith releases to newer versions that included bug fixes and improved invitation handling features.",10,10,,"['help them add users to their organization in their on-premises LangSmith instance without using SMTP email configuration. The issue was resolved by identifying that their version was outdated and needed to be upgraded to support the UI-based invitation acceptance feature.', 'help them with a LangSmith self-hosted deployment issue where invitation acceptance stopped working after upgrading from version 0.9.54 to versions 0.9.77 and 0.9.78 when feature flags for organization creation were set to false. The support team identified this as a regression bug and provided a fix in Helm chart version 0.9.36 with application version 0.9.92.', 'help with LangSmith login issues where they are not receiving confirmation emails despite the system indicating one was sent. The support agent suggested navigating to different sign-up options and trying the login flow again instead of the account creation screen.']"
131,Assist with Microsoft Teams platform migration and setup,"Users requested assistance with internal team communication platform transitions, specifically moving from Slack to Microsoft Teams and setting up new team structures. The requests involved creating new teams, configuring meeting invitations, establishing channels, and managing participant access within the Teams platform.",4,4,,"['create a new team in Teams.', 'help them invite other people to join a meeting. The conversation focuses on different methods for adding participants to a scheduled meeting, including changing permissions, sharing email addresses for manual addition, forwarding invitations, and using alternative meeting platforms.', 'transition from Slack to Teams and create new channels. This is not a LangChain/LangSmith support request, but rather an internal team communication platform migration request.']"
132,Resolve LangGraph Platform deployment infrastructure and configuration issues,"The requests involved troubleshooting various LangGraph Platform deployment and infrastructure issues including application instability, continuous restarts, database capacity problems, TCP socket timeouts, Redis connection failures, and build errors. Users also sought assistance with complex deployment configurations such as multi-tenant authentication setups, concurrent session scaling, ingress configuration, and resolving sync/async execution problems in local development environments.",35,35,,"['provide technical support for LangGraph Platform thread execution control, specifically regarding immediate thread termination, state updates during execution, cancellation signal processing, and scalability considerations for self-hosted Docker deployments including database sharing and load balancing across multiple server instances.', 'help with LangGraph platform deployment issues, including build failures, timeouts, schema extraction problems with custom TypeScript interfaces, and server restart issues when running parallel nodes in their graph deployment.', 'help them with LangGraph Server deployment optimization, specifically seeking guidance on configuration adjustments to reduce the 500ms overhead they observed during on-premise deployment performance testing. The support team provided solutions including adjusting the BG_JOB_DELAY environment variable and log level settings, ultimately resolving the latency issues with a new image release that switched from polling to subscribing for new runs.']"
133,Manage LangSmith organization administration and subscription transfers,"Users requested assistance with comprehensive LangSmith account administration tasks including organization setup, subscription management, user permissions, and billing configurations. The support issues involved complex account transitions such as transferring subscriptions between personal and business organizations, managing startup plan approvals, regional migrations, ownership transfers, and resolving payment and billing access problems.",9,9,,"['help with account setup and subscription management, specifically resolving confirmation email delivery issues and transferring a startup subscription from a personal account to an organization account.', 'provide guidance on how to replace a sole user within their organization with another user without incurring additional charges, specifically needing to transfer access and permissions to a new team member while adhering to their current subscription terms.', 'help with a billing and account management issue involving switching subscription plans between two organizations - downgrading one account from a paid plan back to developer tier and upgrading another organization to a startup plan. The support team successfully processed the plan changes and provided a prorated refund for the downgraded account.']"
134,Provide pricing information and procurement assistance for LangChain products,"Users requested detailed information about pricing models, licensing terms, and commercial usage policies for LangChain, LangSmith, and LangGraph products to evaluate costs for their business implementations. They also sought assistance with enterprise procurement processes, vendor management documentation, and organizational billing configurations to purchase and deploy these platforms for their companies.",20,20,,"['provide clarification on the licensing structure and commercial usage policies for the platform, specifically regarding building agents for clients and ensuring compliance with terms of service for their consulting business model.', 'help with vendor management and procurement processes for purchasing LangSmith Plus subscriptions, including providing vendor qualification forms, company documentation, and establishing a business relationship for organizational procurement.', 'provide information about student pricing or educational access for LangChain and LangGraph for their bachelor thesis research on LLM Workflow Frameworks. The support team confirmed no student pricing plans exist but provided information about free resources, credit-based pricing models, and trial options.']"
135,Transfer LangSmith organization admin roles after employee departures,"Users needed help transferring administrative roles and organization ownership between employee accounts following staff departures and company transitions. The requests involved resolving access issues after terminated employees left organizations, transferring ownership of disabled accounts with payment issues, and maintaining startup program benefits during admin email changes.",3,3,,"[""transfer admin role from a terminated employee's account to another employee's account for their organization. The support team provided login assistance and the issue was successfully resolved by the organization's leadership."", 'transfer ownership of a disabled organization account to a new email address and reactivate the account, which was disabled due to 9 months of failed payments from a former colleague who left the company. The user ultimately decided to create a new organization account and apply for the startup program instead of transferring ownership of the existing account.', ""confirm their startup program status and transfer benefits after changing their organization's admin email address due to a domain transfer, as the startup badge disappeared from their dashboard.""]"
136,Analyze incomplete LangSmith support ticket conversations missing request details,"Users requested analysis and categorization of LangChain/LangSmith support conversations, but the provided conversations contained only automated ticket acknowledgment messages or unclear user mentions without any actual technical support request details. The requests involved attempting to determine support categories when the underlying user issues were not visible or accessible in the conversation content.",10,10,,"['analyze a support ticket acknowledgment message and categorize what type of support request was submitted, though the actual user request details are not visible in the provided conversation.', 'analyze a support ticket conversation and categorize the type of support request, but the actual conversation content only shows automated ticket acknowledgment messages without revealing the underlying technical issue or support need.', 'analyze an automated helpdesk response and categorize what type of support request was submitted, though the actual user request content is not visible in the provided automated ticket confirmation message.']"
137,Follow up on missing or untracked previous support communications,"Users submitted multiple follow-up requests seeking responses to their previous support inquiries, but the support team had no record of or could not locate the original requests. The users were requesting confirmation that their initial communications were received and asking for status updates on pending responses.",6,6,,"['provide a follow-up on a pending response to a previous inquiry, but the support team has no record of the original request and is asking for clarification on what the initial inquiry was about.', 'provide a follow-up on an email that was sent two days ago. The user is asking for confirmation that the email was received.', 'provide a follow-up response to a previous email inquiry, but the specific nature of the original technical support request is not specified in this conversation.']"
138,Fix LangGraph platform dependency configuration and module import errors,"Users experienced deployment failures on the cloud platform due to missing Python module dependencies and configuration file errors where dependency references were incorrectly formatted or missing. The issues were resolved by correcting project structure, fixing dependency configuration files to properly reference requirements.txt files, and adjusting path configurations for cloud environments.",5,5,,"['help with a Docker container configuration issue where a certificate location variable needs to be removed when running scripts locally on Mac due to different file path requirements between containerized and local environments.', 'help with a deployment failure on a cloud instance due to a missing module, specifically needing guidance on how to properly configure dependencies in the configuration file to include packages from a requirements file.', 'help with a deployment error on the platform where the build process was failing due to incorrect configuration in the configuration file, specifically treating ""requirements.txt"" as a package name instead of a file path reference.']"
139,Resolve LangSmith self-hosted deployment storage capacity and disk management issues,"Users requested assistance with resolving storage capacity issues and optimizing disk space management in their LangSmith self-hosted deployments. The support involved configuring TTL settings for data retention, migrating to S3 blob storage, expanding ClickHouse database storage, and troubleshooting storage-related infrastructure problems that were preventing proper trace storage and platform functionality.",8,8,,"['clarify the checkpointer TTL (time-to-live) configuration and deletion strategy for disk storage management, specifically asking about when thread expiration triggers checkpoint cleanup and requesting immediate deletion of stored data to prevent disk space issues.', 'help with a self-hosted deployment infrastructure issue where local disk storage is running out of space despite having S3 configuration, ultimately leading to planning a major version upgrade to resolve storage optimization problems.', 'provide guidance on adding storage space to their ClickHouse database to resolve storage capacity issues. The user successfully followed the provided documentation steps and increased their storage space, with the final result showing expanded disk capacity for the ClickHouse data directory.']"
140,Delete duplicate LangSmith accounts and organizations,"Users requested administrative support to delete duplicate accounts, mistakenly created organizations, and incorrectly placed traces within their LangSmith workspace environments. Support agents successfully processed these data deletion requests and provided guidance on organization management, seat removal, and admin role changes through the LangSmith platform.",16,16,,"['rename an organization in their account because they accidentally created a duplicate organization with the same name, which was causing confusion. The support team provided instructions on how to update the organization name using the API since this functionality is not available in the UI.', 'delete an organization that was created by mistake and had no users or projects yet. The support team successfully processed and completed the organization deletion request.', 'delete an organization from their account, as there was no way to do this through the user interface. The support team successfully processed and completed the organization deletion request.']"
141,Resolve LangSmith self-hosted license key and upgrade issues,"Users experienced various licensing and upgrade issues with their LangSmith self-hosted deployments, including invalid license key errors, expired licenses, and JWT token validation problems when upgrading to version 0.9 and later versions. Support requests also involved technical guidance on maintaining data persistence during upgrades, configuring proper network access for license validation, and resolving backend pod failures and database migration errors during the upgrade process.",15,15,,"['help them with their LangSmith self-hosted license key validation issues, specifically getting an ""Invalid license key"" error when trying to use their new v0.9 license key and needing guidance on proper configuration and JWT token handling for their self-hosted environment.', 'provide a new self-hosted license key for their LangSmith deployment, as their current license had expired and was preventing them from deploying their non-production environment.', 'help with upgrading their on-premises LangSmith installation from version 0.7.20 to 0.9.86, specifically seeking guidance on whether they need to update license keys or allow network access to beacon endpoints when operating in ""offline mode"". The support agent confirmed their old keys should work in offline mode and recommended doing incremental version upgrades while noting that API key formats changed between versions which may require updating deprecated keys.']"
142,Troubleshoot LangSmith platform performance and scaling optimization issues,"Users requested help troubleshooting LangSmith platform performance and scaling issues, including slowness, latency spikes, 503 errors, database saturation, and resource optimization for high-concurrency deployments handling hundreds to thousands of concurrent processes. The support involved guidance on auto-scaling configurations, infrastructure sizing, queue worker settings, database optimizations, and deployment stability solutions for both cloud and self-hosted LangSmith instances.",11,11,,"['help with LangSmith performance issues including slowness across the platform, particularly with tracing projects, dataset experiments, evaluations, and platform revision pages, along with a request for best practices guidance on scaling self-hosted components.', 'understand CPU utilization and billing for LangSmith when running concurrent processes, and to know where to view utilization statistics to identify high load periods.', 'help with LangSmith cloud deployment stability issues, specifically seeking auto-scaling solutions and a way to restart/reboot their instance when it crashes under high concurrent usage (>10 requests) instead of having to deploy new revisions each time.']"
143,Provide conversation analysis and summarization for support interactions,"Users requested conversation analysis and summarization services related to various support interactions and communications. The requests focused on providing comprehensive summaries, analyzing cancelled meetings, and generating general greeting messages rather than addressing specific LangChain or LangSmith technical issues.",6,6,,"['provide a summary of the conversation.', 'analyze a conversation about a scheduled call that was ultimately cancelled due to lack of agenda items and participant availability.', 'provide a comprehensive summary of the conversation.']"
144,Configure LangSmith Playground infrastructure and API key management,"Users requested various configuration and infrastructure improvements for LangSmith Playground functionality, including adding new providers, resolving IP address and firewall access issues, and setting up workspace-level API key management. They also sought help with authentication configuration, DNS resolver setup, and API key persistence to improve the overall Playground user experience and deployment flexibility.",6,6,,"['add a new provider to the playground functionality.', 'confirm the IP addresses for the service and resolve intermittent PermissionDeniedError issues in the Playground due to Virtual Network/Firewall rules blocking access.', 'set up workspace-level API key secrets for the Playground feature so that all workspace users can access shared credentials instead of each user having to configure their own individual API keys.']"
145,Resolve LangGraph agent 404 errors after monorepo migration,The user needed help resolving 404 errors when accessing their deployed LangGraph agent after migrating from a single service architecture to a monorepo architecture. Their backend service could no longer successfully communicate with their cloud-hosted agent despite using the same API credentials.,1,1,,"['resolve 404 errors when accessing their deployed agent after migrating from a single service architecture to a monorepo architecture, where their backend service can no longer successfully communicate with their cloud-hosted agent despite using the same API credentials.']"
146,Analyze LangSmith support conversation categorization and Playground feature issues,"Users needed assistance analyzing and categorizing various LangSmith and LangChain support conversations to understand the specific nature of technical issues discussed. The requests focused on interpreting support interactions, with one specific case involving a LangSmith Playground rendering toggle feature that was confirmed to be problematic and scheduled for removal.",8,8,,"['provide a response to the question about the preceding support conversation.', 'answer a question about the preceding support conversation.', 'answer the question about the preceding support conversation.']"
