cluster_id,name,description,size,total_size,member_clusters,sample_summaries
0,Filter unsolicited business and marketing spam from support channels,"Users sent multiple unsolicited business inquiries including partnership proposals, marketing services, job applications, investment opportunities, and promotional collaborations to LangChain support channels. These requests were appropriately categorized as spam since they involved non-technical solicitations unrelated to LangChain, LangSmith, or LangGraph technical support needs.",16,16,,"[""respond to a promotional email from a third-party AI agent marketplace seeking to schedule a demo call. This is categorized as spam since it's an unsolicited marketing inquiry unrelated to technical support."", 'share and engage with a recruitment post on social media that highlights their company\'s use of LangChain tools in their engineering stack. This falls under the ""Other Support - Spam"" category as it\'s a non-technical marketing/promotional request rather than a genuine support need.', ""provide social media management services for the company, offering to work for free for the first two weeks. This is categorized as spam since it's an unsolicited marketing outreach rather than a technical support request.""]"
1,Resolve LangSmith Datasets & Experiments platform bugs and data display issues,"Users experienced multiple technical issues with LangSmith's Datasets & Experiments functionality, including dataset version tagging problems, experiment view reporting failures after dataset restores, API errors during evaluation pipeline processing, and missing data in experiment results. The support team resolved most issues through platform upgrades, server-side bug fixes, feature reactivation, and providing workarounds for UI/UX limitations in self-hosted deployments.",14,14,,"[""help them with their LangSmith support request about dataset version tagging issues in the JavaScript client's evaluate function, where inconsistent timestamp precision and deleted examples cause incorrect version tracking, preventing reliable post-experiment dataset version tagging."", 'help them with a LangSmith Datasets & Experiments issue where experiment view reporting was broken after a dataset restore, specifically when running evaluations on older tagged dataset versions where the CLI worked but the UI showed empty runs despite traces being generated.', 'help them with their LangSmith evaluation function issues, specifically 404 and 503 errors encountered when accessing datasets through the evaluation API during their automated evaluation pipeline processing multiple minibatches of traces.']"
2,Increase LangGraph platform deployment quotas for advanced multi-environment workflows,"Users requested increases to their LangGraph platform deployment quotas to support multiple environments, testing, and scaling needs, with requests ranging from basic staging/production setups to complex multi-agent deployments requiring 3-5+ deployments. These requests were often coupled with additional technical needs including CI/CD pipeline implementation, performance troubleshooting, browser automation integration, authentication features, and broader LangSmith ecosystem consultation services.",11,11,,"['increase their development quota for custom agents on the platform. They want to deploy more custom agents for development purposes while understanding that production deployment may remain restricted due to cost considerations.', 'provide a second deployment for their platform to implement a CI/CD pipeline for their agent development, and they also inquired about month-to-month enterprise tier package options.', 'deploy a second agent for A/B testing purposes. The user wanted to know what steps were needed to deploy the second agent and whether there would be additional charges for the second deployment.']"
3,Process individual LangSmith account deletion requests under privacy regulations,"Users submitted requests to delete their personal accounts and associated data from the LangSmith platform, citing privacy regulations like GDPR or indicating they had signed up by mistake. The support team directed users to complete Data Subject Access Request (DSAR) forms to process these individual account deletion requests and confirmed completion of the data removal.",22,22,,"['delete their account from the platform. The support team directed them to complete a data subject access request form to process the account deletion.', 'delete their account and all personal data from the platform. The support team processed this data deletion request and confirmed completion of the account and data removal.', 'delete their account and personal data from the platform. This is a data deletion request under privacy regulations.']"
4,Resolve LangGraph platform deployment failures and production disruptions,"Users experienced various critical LangGraph platform deployment failures including system exit errors, asyncio cancellation issues, unexpected deployment deletions, and authentication problems that disrupted production environments. Support teams addressed these issues by identifying control plane problems, resolving licensing configuration errors, fixing auto-migration failures, and troubleshooting environment variable conflicts that prevented successful deployments.",23,23,,"['help with LangGraph platform deployment issues, specifically requesting an increased beta quota for deployments and then troubleshooting GitHub integration authentication errors that prevented successful deployment revisions.', 'help with a LangGraph platform deployment issue where their server revisions are failing with system exit and asyncio cancellation errors after building successfully. The support team identified a control plane issue for creating new revisions and provided a fix, recommending the user try deploying a new revision.', 'help with a LangGraph platform deployment migration issue where their deployment on legacy infrastructure failed to auto-migrate and requires manual intervention to create a new working revision before a specified deadline to avoid permanent project deletion.']"
5,"Resolve LangChain
Python OSS component integration and implementation issues","Users
experienced technical issues with various LangChain Python OSS components
including ValueError with FireCrawlLoader URL crawling parameters, Agent Chat
UI customization in Next.js, LangGraph Python project problems, and metadata
filtering limitations for nested keys. The support team consistently directed
users to open GitHub issues for community assistance rather than providing
direct technical solutions via email support.",4,4,,"[""help with a technical issue they're experiencing with the FireCrawlLoader component in the LangChain Python library, specifically a ValueError about unsupported parameters when trying to crawl URLs. The support agent directed them to open a GitHub issue for community assistance with their OSS Python implementation problem."", 'help them customize the LangChain Agent Chat UI in Next.js to hide internal system messages and only display final answers to users, along with guidance for adapting the UI for user testing prototypes. The support team redirected them to GitHub issues rather than providing direct technical assistance via email.', 'provide a summary of the conversation, which is a request for assistance with a LangGraph Python open-source project issue, with the support agent directing them to open a GitHub issue with a minimal reproducible example.']"
6,"Address general platform
administration and billing support issues","Users contacted
support for a diverse range of administrative and platform issues including
billing inquiries, account concerns, API rate limit questions, and platform
access problems. The requests also included technical issues like SSL
certificate errors, thread resumption via HTTP API, and deployment
configuration assistance.",14,14,,"['help them understand the nature of the support request in the conversation. The conversation shows a billing inquiry about a payment request that was ultimately confirmed as already processed through a payment platform.', 'help them understand how to resume an existing thread run after an interrupt using the HTTP API, rather than creating a new run within the thread.', 'provide information about their current API rate limits for the platform, specifically asking about current limits, whether limits are per API key, and if adjustments can be made. The support team directed them to the documentation and offered to review specific error examples.']"
7,Categorize non-technical conversations misclassified as LangChain support requests,"Support requests
asked to analyze conversation content for categorization within the LangChain
ecosystem, but most contained non-technical content like spam, automated
responses, or unrelated communications. These requests involved attempting to
classify support interactions that lacked actual LangChain, LangSmith, or
LangGraph technical issues.",16,16,,"[""analyze a support conversation and categorize the user's specific LangChain support request, but no actual conversation content was provided to analyze."", 'analyze and categorize a support conversation to determine what specific LangChain/LangSmith support issue was being addressed.', 'analyze a conversation that appears to be internal team coordination for a scheduled presentation or demo session about LangSmith, rather than a customer support request.']"
8,Optimize LangSmith tracing performance and cost management issues,"Users experienced various LangSmith tracing performance and cost management issues including excessive trace generation, trace mixing between services, API rate limiting, and inconsistent pricing calculations. They sought help with optimizing trace volumes, implementing proper cost tracking, resolving API errors, and improving tracing performance in production environments.",20,20,,"['help with LangSmith tracing issues where 20-40% of traces were not being submitted to the platform in their production FastAPI environment, despite no error messages appearing in logs. The support team helped diagnose the issue and provided solutions including updating the SDK version and implementing the wait_for_all_tracers() method, plus guidance on programmatic monitoring of trace submissions.', 'help resolve ""Too Many Requests"" errors they are encountering when using the API to extract data from runs, specifically when calling the list_runs method with delta records filtering.', 'help with performance issues when creating feedback in LangSmith at scale, specifically that the create_feedback API calls were taking too long when running large experiments with hundreds to thousands of examples across multiple machines, and the solution involved using the trace_id parameter to enable batching for better performance.']"
9,Resolve LangSmith platform account administration and deployment issues,"Users requested support to resolve complex administrative and technical issues with LangSmith platform accounts, including billing problems, startup plan management, authentication failures, and self-hosted deployment configuration errors. The support team provided solutions ranging from account credits and plan transfers to database migration fixes and custom authentication setup assistance.",14,14,,"['help with a technical issue where clicking the ""Get started"" button on their onboarding page was not working properly. The issue was eventually resolved after troubleshooting authentication problems and configuring service routing for their self-hosted deployment.', ""help with downgrading from a Plus plan to a Developer plan and resolving billing issues when they couldn't access the platform or select the desired plan. The support interaction involved providing account credits, processing refunds, and helping the user temporarily regain access to export their traces before creating a new organization."", 'help resolve database migration failures in their self-hosted deployment after attempting to rollback from version 0.7.5 to 0.6.24, which prevented users from being added to their organization. The issue required fixing stuck database migrations and ultimately upgrading to version 0.9 instead of rolling back.']"
10,Resolve duplicate billing charges across regional accounts,"Users experienced duplicate billing charges across multiple regions (US and EU) when they had accounts with the same email address or migrated between regions, requiring refunds for the duplicate invoices. One user also inquired about the status of their affiliate program application review process.",6,6,,"['investigate and resolve a double-charging issue on their invoices, which was caused by having duplicate accounts in both US and EU regions with the same email address.', 'resolve duplicate billing charges for the same account. The user was being charged twice for identical services across two separate organizations in different regions, and requested a refund for one of the duplicate charges.', 'get a refund for a duplicate invoice after switching from the US to EU region, as they were unexpectedly charged twice when migrating their subscription. The support agent processed the refund for the US account invoice.']"
11,Configure LangSmith SSO authentication and organization management settings,"Users required assistance with LangSmith authentication and access management, including SSO roles/groups validation for user access restrictions and resolving login issues after database migrations. They also needed clarification on LangSmith pricing plans, licensing calculations for active users, data security features, and organization management capabilities including deletion and renaming options.",3,3,,"[""provide information about the user's overall support request. The user requested help with SSO roles/groups validation in LangSmith to restrict user access and clarification on how active users are calculated for licensing purposes when using authentication providers."", 'provide information about LangSmith pricing plans (including startup and enterprise options), clarify data handling and security features for sensitive information, explain the technical workflow of API requests and tracing, and help with organization management including deletion or renaming of an organization.', ""provide a summary of the user's LangSmith support request. The user reported SSO login issues after a database migration, which was ultimately resolved when they discovered their pods hadn't properly restarted and were still connected to the old database.""]"
12,Analyze deleted or incomplete LangSmith support conversations,"Users requested analysis of various LangChain/LangSmith support conversations, but the vast majority of these conversations had deleted or missing content making it impossible to determine the specific technical issues. One identifiable request involved a bug report where cache_creation token counts were not displaying in the LangSmith popover despite being present in API response metadata when using bedrock models with caching functionality.",13,13,,"[""answer the question about what the user's overall LangChain/LangSmith support request is. However, the conversation content is not available as all messages were deleted, making it impossible to determine the specific support request."", ""analyze the conversation and determine what the user's overall LangChain/LangSmith support request is. However, the conversation provided is incomplete, with one message being deleted, making it impossible to determine the specific support request from the available information."", 'help them understand the user\'s overall LangChain/LangSmith support request from the preceding conversation. However, the conversation content shows ""This message was deleted"" so the specific technical issue cannot be determined, though the title indicates it relates to LangGraph Python class implementation with different input and output states.']"
13,Filter unsolicited SEO marketing spam from support channels,"Multiple unsolicited marketing contacts attempted to promote SEO, backlink, and website optimization services through the LangChain support channels. These spam communications offered various search engine ranking improvement services including meta tag optimization, guest posting, and link exchange collaborations unrelated to LangChain technical support.",8,8,,"['provide SEO and promotional services to help improve website ranking on search engines. This is spam/unsolicited marketing and not a legitimate technical support request.', 'provide SEO services for a website, which is spam/unsolicited marketing rather than a legitimate technical support request.', 'provide SEO and promotional services to get their website to the first page of search results. This is spam/unsolicited marketing rather than a legitimate support request.']"
14,Handle unsolicited marketing and SEO spam messages,"Support staff received multiple unsolicited marketing emails offering SEO services, guest posting opportunities, backlink services, and domain sales that were unrelated to LangChain technical support. These spam messages required categorization and closure without response to maintain support ticket quality and prevent further unsolicited commercial outreach.",14,14,,"[""provide a response to their unsolicited marketing offer for guest posting and backlink services, which falls under the spam category as it's an unsolicited commercial email unrelated to technical support."", 'categorize a potential spam or phishing message as spam and close the ticket without responding to it.', 'help with a job opening advertisement submission. This is not a LangChain/LangSmith support request, but rather spam or unsolicited content unrelated to technical support.']"
15,Enhance LangSmith experiment management and evaluation workflow features,"Users requested various enhancements and support for LangSmith's experiment management and evaluation workflow features. They sought help with comparison views for multi-output experiments, re-running failed evaluators, experiment sharing capabilities, custom code evaluators with network access, dataset commenting functionality, and programmatic access to experiment data through APIs.",16,16,,"['help them share a single experiment (with all the runs) with a 3rd party by giving someone temporary access to the langsmith web ui.', ""schedule a meeting to discuss their LangSmith dataset testing at scale, specifically to review their experimental approach and discuss performance issues they're experiencing."", ""help them understand how to implement custom code evaluators that can make REST API calls for online evaluation in LangSmith, since the current custom code environment doesn't support network connectivity. The support team provided a workaround using webhooks and the SDK to achieve this functionality.""]"
16,Provide LangSmith Data Processing Agreements for regulatory compliance,"Users requested access to Data Processing Agreements (DPAs) from LangSmith/LangChain for legal compliance purposes, specifically to meet GDPR, HIPAA, and other data protection regulatory requirements. The support team consistently responded by providing pre-signed DPA forms through document signing platforms and directing users to the trust center for additional compliance documentation.",12,12,,"['provide a Business Associate Agreement (BAA) and Data Processing Agreement (DPA) for compliance review to ensure proper data protection and regulatory alignment with HIPAA, GDPR, and other applicable privacy regulations.', 'provide a Data Processing Agreement (DPA) for their organization. The support team responded by providing a pre-signed DPA form that the user can fill out and sign electronically.', 'provide the full text of the Data Processing Agreement (DPA) for legal review, as they need to comply with personal information protection regulations when transferring data internationally. The support team directed them to a DocuSign link where they can view and download the DPA without signing it on the first page.']"
17,Increase LangGraph platform deployment quota limits,"Users requested to increase their LangGraph platform deployment quotas from the default limit of 1 deployment to multiple deployments, primarily to support separate development and production environments. Support teams consistently approved these requests and upgraded users to 5 deployments, noting that increases were available at no cost during the open beta phase.",45,45,,"['increase their deployment quota. The support agent successfully upgraded their quota from 1 to 5 deployments.', ""add a second deployment to their organization's account for their application, so they can freeze their current production version while continuing development on an improved version. The support team successfully fulfilled this request by adding another deployment to bring their total count to 2."", 'increase their deployment quota from 1 to 2 for the cloud platform. They want to test migrating their current deployment from another cloud provider to the platform and need additional quota capacity for comparison testing.']"
18,Analyze and categorize LangChain support conversation content,"Users requested help analyzing and categorizing various LangChain/LangSmith support conversations to understand the nature of technical issues being reported. The requests included analyzing conversations about LangSmith tracing dashboard errors, experiment feedback bugs, latency issues, and filtering out spam inquiries unrelated to LangChain services.",21,21,,"[""provide a comprehensive analysis of the user's specific support request based on the conversation provided. The user is asking the assistant to categorize and describe what type of LangChain/LangSmith support the customer in the conversation was seeking."", ""categorize and analyze a support conversation between an AI assistant and a user. The conversation involves an unsolicited business offer from a petroleum company, which the AI assistant appropriately declined as spam/non-technical inquiry since it's unrelated to LangChain services."", 'provide a comprehensive analysis of the conversation and categorize the support request according to the provided framework. The user is asking for help in understanding what type of LangChain/LangSmith support issue was being addressed in the production outage scenario.']"
19,Resolve LangGraph library bugs and development tool issues,"Users experienced various technical issues with LangGraph libraries and development tools, including problems with nested configuration support, graph visualization methods failing due to recent code changes, and dependency version mismatches. They also encountered difficulties with LangGraph Studio functionality, missing documentation references, API compatibility errors, and implementation challenges with features like Agent Inbox and generative UI components.",25,25,,"['help them get their developer seat back on LangSmith after trying the plus plan without getting extra use, and to enable 4-5 deployments on LangGraph platform.', 'help them with a bug in the LangGraph JavaScript library where the recursion limit configuration parameter is being ignored, causing their application to hit the default limit of 25 instead of their specified limit of 50. The user submitted both a bug report and a fix via GitHub pull request and is seeking an estimated timeline for when the fix will be released.', 'help them with a LangGraph error that was occurring in their remote deployment but not locally, which was ultimately resolved when support identified it was caused by a breaking change in the third-party API that required updating their package version. The user also made a feature request for better error surfacing in the platform to help identify such issues more quickly in the future.']"
20,Complete third-party security questionnaires and privacy assessments using trust center,"These requests involved users seeking help completing third-party security review questionnaires, privacy assessments, and compliance documentation for various vendor evaluation and risk management processes. The support team consistently directed these users to the trust center for accessing security and compliance materials to fulfill their assessment requirements.",17,17,,"['provide information about the security measures section of the platform assessment. The support agent directed them to the trust center for security and compliance documentation.', 'complete a privacy assessment for the platform, specifically requesting information across multiple sections including general information, hosting, data processing, security measures, and artificial intelligence/machine learning components. The support team directed them to the trust center for security and compliance documentation to help complete their assessment.', 'complete an overdue privacy assessment for a service, and the support team directed them to the trust center for security and compliance information.']"
