cluster_id,name,description,size,total_size,member_clusters,sample_summaries
0,Classify customer support conversations for technical issue identification,"<summary>
The work involved analyzing and categorizing customer support conversations to identify technical LangChain issues versus non-technical business inquiries. A classification system was implemented to separate legitimate technical support requests from outlier categories including administrative tasks, marketing inquiries, spam, and general business communications.",10,276,"[np.int32(0), np.int32(17), np.int32(23), np.int32(27), np.int32(31), np.int32(45), np.int32(50), np.int32(56), np.int32(86), np.int32(93)]",
1,Troubleshoot LangChain integration errors and cross-provider compatibility issues,"<summary>Developers encountered various integration challenges when working with LangChain components, including cross-provider model compatibility issues, runtime errors, and problems with structured output schemas and Pydantic integration. They sought technical support for troubleshooting library integrations, implementing missing functionality, extending platform capabilities with third-party AI models, and resolving self-hosted platform upgrade complications.",8,150,"[np.int32(1), np.int32(35), np.int32(41), np.int32(61), np.int32(85), np.int32(88), np.int32(89), np.int32(114)]",
2,Manage LangSmith and LangGraph billing subscriptions and enterprise licensing,"<summary>
These clusters involved managing LangSmith and LangGraph billing operations, including subscription management, invoice processing, pricing inquiries, and resolving payment-related issues. The work encompassed configuring organizational billing settings, handling trace limit quotas, processing refunds and disputes, and obtaining enterprise licensing information for deployment planning.",16,386,"[np.int32(2), np.int32(5), np.int32(6), np.int32(36), np.int32(42), np.int32(43), np.int32(48), np.int32(55), np.int32(65), np.int32(66), np.int32(74), np.int32(104), np.int32(107), np.int32(112), np.int32(116), np.int32(122)]",
3,Configure self-hosted LangSmith enterprise deployments and infrastructure management,"<summary>
The clusters focused on deploying and managing self-hosted LangSmith installations across various enterprise environments, including Kubernetes infrastructure, compliance configurations, and production monitoring setups. Developers worked to resolve deployment issues, configure license verification, troubleshoot API server problems, and handle regional account migrations for LangSmith platform operations.",7,156,"[np.int32(3), np.int32(11), np.int32(46), np.int32(54), np.int32(57), np.int32(67), np.int32(91)]",
4,Debug LangSmith tracing integration and production monitoring issues,"<summary>
Developers implemented and troubleshot LangSmith tracing systems for AI applications, configuring trace filtering, metadata management, and dashboard visibility features. They debugged runtime execution failures, performance issues, and production deployment problems while managing tracing project lifecycles and integration configurations.",9,196,"[np.int32(4), np.int32(10), np.int32(47), np.int32(97), np.int32(101), np.int32(102), np.int32(113), np.int32(115), np.int32(124)]",
5,Scale LangGraph cloud deployment infrastructure and resolve platform stability issues,"<summary>
Developers worked to resolve LangGraph and LangChain cloud deployment infrastructure challenges including quota limitations, scaling bottlenecks, and platform stability issues. They configured storage management settings, troubleshot migration failures, and implemented custom networking solutions to optimize cloud-based AI agent platform deployments.",10,287,"[np.int32(7), np.int32(12), np.int32(18), np.int32(33), np.int32(34), np.int32(51), np.int32(68), np.int32(82), np.int32(83), np.int32(84)]",
6,Analyze spam and phishing messages for security threat classification,<summary>The work involved analyzing spam and phishing messages to identify and classify security threats. This focused on content analysis techniques to detect malicious communication patterns for security protection purposes.,2,49,"[np.int32(8), np.int32(70)]",
7,Configure and debug LangSmith evaluation workflows and dashboards,"<summary>
Developers worked on configuring, troubleshooting, and debugging LangSmith evaluation workflows, dashboards, and LLM-as-judge evaluators. They addressed platform bugs, configuration issues, data management functionality, and analytics monitoring within the LangSmith evaluation ecosystem.",6,117,"[np.int32(9), np.int32(30), np.int32(53), np.int32(60), np.int32(103), np.int32(106)]",
8,Build and debug advanced LangGraph multi-agent workflows with streaming,"<summary>
Developers implemented advanced LangGraph workflows with multi-agent architectures, custom streaming controls, and complex state management patterns. They debugged various runtime issues including SDK bugs, cloud deployment connectivity problems, and execution failures across different LangGraph environments.",9,254,"[np.int32(13), np.int32(15), np.int32(21), np.int32(39), np.int32(40), np.int32(44), np.int32(78), np.int32(96), np.int32(119)]",
9,Troubleshoot LangSmith authentication and account management configuration issues,"<summary>
Developers encountered various authentication, account management, and access control issues across LangSmith platform deployments, including SSO configuration failures, SSL certificate errors, and organization administration problems. Technical work involved troubleshooting API connectivity, resolving email delivery systems for invitations, configuring helm chart automation for self-hosted environments, and managing user permissions and account deletion processes.",12,297,"[np.int32(14), np.int32(32), np.int32(37), np.int32(49), np.int32(52), np.int32(77), np.int32(81), np.int32(94), np.int32(95), np.int32(98), np.int32(100), np.int32(120)]",
10,Filter commercial spam from LangChain technical support channels,"<summary>The system processed and categorized various unsolicited commercial communications including SEO services, business partnerships, domain sales, and promotional inquiries that were submitted to technical support channels. These non-technical requests were systematically identified and filtered as outliers to separate them from legitimate LangChain development support tickets.",9,172,"[np.int32(16), np.int32(19), np.int32(25), np.int32(72), np.int32(80), np.int32(87), np.int32(92), np.int32(105), np.int32(110)]",
11,Debug LangSmith platform UI bugs and enhance core functionality,"<summary>Developers worked to resolve various bugs and functionality issues across the LangSmith platform, including problems with model tagging, assistant management, trace visibility, and UI display components. They also enhanced core platform features such as annotation queues, dataset management interfaces, bulk data export capabilities, and SDK integration while addressing playground prompt development and experiment platform performance issues.",12,303,"[np.int32(20), np.int32(24), np.int32(28), np.int32(63), np.int32(71), np.int32(73), np.int32(75), np.int32(76), np.int32(109), np.int32(111), np.int32(117), np.int32(121)]",
12,Troubleshoot LangGraph Platform and LangSmith enterprise deployment issues,"<summary>Developers worked on resolving deployment failures, build errors, and production outages across LangGraph Platform and LangSmith in enterprise self-hosted environments. They addressed Docker configuration issues, service disruptions, and performed infrastructure migrations while preserving data integrity.",5,136,"[np.int32(22), np.int32(58), np.int32(62), np.int32(64), np.int32(79)]",
13,Complete LangSmith enterprise compliance and security documentation requirements,"<summary>
The clusters focused on completing comprehensive vendor security and privacy compliance assessments for LangSmith platform integration, including GDPR data subject access request processing and business associate agreement procurement. The work involved obtaining security certifications, completing third-party vendor questionnaires, and gathering all necessary compliance documentation for enterprise LangSmith deployment.",6,135,"[np.int32(26), np.int32(29), np.int32(38), np.int32(59), np.int32(69), np.int32(118)]",
14,Report security vulnerabilities and implement API authentication remediation,"<summary>The clusters focused on identifying and reporting security vulnerabilities across API authentication systems, email security, and platform access controls. The work involved conducting penetration testing, implementing security remediation measures, and establishing bug bounty program inquiries for deployment infrastructure.",4,76,"[np.int32(90), np.int32(99), np.int32(108), np.int32(123)]",
