cluster_id,name,description,size,total_size,member_clusters,sample_summaries
0,Build LangGraph multi-agent systems with conversational memory and state persistence,"<summary>
Developers built multi-agent orchestration systems using LangGraph workflows with state management and persistence capabilities. They also implemented LangChain chatbots with conversational memory and message handling while resolving various application development issues.",4,135,"[np.int32(0), np.int32(2), np.int32(11), np.int32(12)]",
1,Build RAG systems with recursive web content loading using LangChain and LangGraph,"<summary>
The developer worked on implementing recursive webpage content extraction using LangChain's RecursiveUrlLoader component for automated web scraping workflows. They then integrated this web content loading capability into RAG (Retrieval-Augmented Generation) systems built with both LangChain and LangGraph frameworks.",2,48,"[np.int32(1), np.int32(6)]",
2,Debug LangChain integration errors and deployment failures,"<summary>Developers worked to identify and resolve integration errors, runtime failures, and deployment issues across LangChain's core framework and associated platforms. The technical work focused on debugging tool integration patterns, troubleshooting platform configuration problems in LangGraph and LangSmith, and addressing various runtime failures that occurred during LangChain application development.",3,58,"[np.int32(3), np.int32(5), np.int32(15)]",
3,Provide general technical support across multiple development domains,<summary>The clusters involved providing broad technical support and conversational assistance across multiple domains and technologies. Development work encompassed diverse full-stack tasks spanning various technical frameworks and responding to general informational requests.,3,123,"[np.int32(4), np.int32(9), np.int32(13)]",
4,Configure and troubleshoot LangChain vector store integrations,"<summary>
Developers worked on setting up and resolving issues with LangChain vector store integrations, focusing on proper configuration and troubleshooting connection problems. The work involved diagnosing integration failures, configuring vector database connections, and ensuring proper setup of vector store components within LangChain applications.",1,24,[np.int32(7)],
5,Learn LangChain fundamentals and configure local Ollama LLM integration,"<summary>
The work involved learning LangChain framework fundamentals and core components to establish proper LLM integrations. Developers set up local LLM deployments using Ollama integration and troubleshot various framework configuration issues during the learning process.",3,106,"[np.int32(8), np.int32(10), np.int32(14)]",
