cluster_id,name,description,size,total_size,member_clusters,sample_summaries
0,Design and implement production multi-agent AI system architectures,"Users sought help building production-level multi-agent AI architectures,
including supervisor-agent routing, state management, tool integrations, and
structured data handling across components. The requests focused on practical
implementation details like proper parameter passing, deployment configurations,
and integration of different AI models and providers into maintainable systems.",19,19,,"['understand the licensing and organizational structure options for a cloud-based AI platform, including the ability to create multiple organizations and workspaces to separate different customer solutions.', 'help refactor and debug their multi-agent AI system architecture, specifically related to routing and state handling between the supervisor and sub-agents.', 'explain the instructions for deploying and configuring agents for the Open Agent Platform, including options for local development and production deployment.']"
1,Learn to use LangChain's RecursiveUrlLoader for webpage content extraction,Users sought help learning how to use the RecursiveUrlLoader component in LangChain to load content from webpages and their child links. They specifically wanted to understand how to recursively traverse and extract content from linked pages using this LangChain loader functionality.,14,14,,"['learn how to use the RecursiveUrlLoader in LangChain to load content from a webpage and its child links.', 'learn how to use the RecursiveUrlLoader in LangChain to load content from a web page and its child links recursively.', 'learn how to use the RecursiveUrlLoader in LangChain to load content from a webpage and its child links recursively.']"
2,Learn to implement specific LangChain framework features and integrations,"Users requested help implementing and
understanding specific features and tools within the LangChain and LangGraph
frameworks, particularly around memory, embeddings, structured output, and model
integrations. They sought concrete guidance and examples for technical tasks like
using FAISS, handling JSON schemas, working with prompt templates, and setting up
various model integrations like DeepSeek and Ollama.",23,23,,"['learn how to implement long-term memory in an AI chatbot using LangChain and LangGraph.', 'provide Python code to chat with a website using LangChain and OpenAI.', 'provide information about the book ""Generative AI with LangChain - Second Edition: Build production-ready LLM applications and advanced agents using Python, LangChain, and LangGraph"".']"
3,Deploy and configure multi-user LangGraph applications with MCP and organization isolation,"The statements involved users seeking technical help deploying and managing multi-user LangGraph/LangSmith applications, with a focus on MCP (Model Context Protocol) servers/clients, organization setup, and platform deployment options. Common themes included setting up authentication, handling concurrent users, managing multiple organizations/workspaces, and deploying on platforms like GCP and AWS with proper isolation between customers.",17,17,,"['learn how to switch from a development to a production deployment type on the LangGraph platform, as the deployment type cannot be changed after creation.', 'understand how to set up multiple organizations within a self-hosted LangSmith deployment on a VPC like AWS.', ""learn about the LangGraph framework, including how to quickly create a new LangGraph project, the components and structure of a LangGraph project, and the use of the Handoffs mechanism in LangGraph's multi-agent system.""]"
4,Build a RAG system to query databases and local documents,"The users sought help
with implementing RAG-based and data-augmented LLM applications, focusing on SQL
queries, PDF retrieval, database summaries, and structured output solutions. The
requests emphasized practical implementation details like prompt tuning, data
formatting, clarifying questions, and specific integrations with tools like
SingleStoreDB.",20,20,,"[""build a system that can access and analyze data from a construction cost management system, and generate code to retrieve and display relevant information based on the user's natural language queries."", 'help them develop a full-stack web application based on agentic AI technology.', 'help them understand how to use Chroma DB and find the most appropriate text fragments to include in a response. The user is also seeking guidance on how to structure their agent tools and handle variables in their tool functions.']"
5,"Configure chat models and
generate viral prompts for chatbots","Users requested help
with various aspects of manipulating chat models and prompt workflows, including
disabling/configuring ""think mode"", extracting conversational states, and
generating viral prompts for chatbots like ChatGPT and Claude. The technical
queries were focused on tasks like updating conversation memory, compressing
message history, and generating novel prompt templates, while avoiding common
pitfalls like repetitive outputs.",10,10,,"['help them understand how to disable or configure the ""think mode"" feature when using the ChatOpenAI interface to access the Qwen3 model.', 'consolidate and provide feedback on two emails related to a political campaign for the Congolese diaspora in Senegal.', ""store their conversational states in a MongoDB database, and to be able to invoke the assistant's graph with a specific thread ID to maintain persistent conversation history.""]"
6,Get help installing and configuring LangChain development environment,"These questions focused
on basic installation, configuration, and setup of the LangChain library across
different development environments like PyCharm and VS Code. Users sought help with
technical issues related to dependencies, virtual environments, and core LangChain
features like text splitting, memory management, and database integrations.",24,24,,"['help resolve an issue with installing or running the LangGraph CLI, which the user is unable to access due to a ""command not found"" error.', 'understand the support and features available in LangChain and LangGraph for Postgres database and related management.', 'get guidance on how to install and set up LangChain, a machine learning library, including which additional packages to install and how to create a virtual environment in Visual Studio Code on Windows.']"
7,Debug code and fix technical issues with multi-agent systems and data processing,"Users sought help debugging and fixing technical issues with code, primarily related to multi-agent systems, data processing, and API integration. They also asked for guidance on practical programming tasks like loading JSON files, formatting docstrings, and color filter conversion, along with some basic service requests that could not be fulfilled.",23,23,,"['help debug an issue with their multi-agent system, where the supervisor agent is not properly passing the full state to the sub-agents, causing the system to not respond as expected.', 'learn how to properly format docstrings for their tools.', 'help with word puzzles and number-to-words conversions, particularly related to currency amounts in Indian Rupees.']"
8,Debug Neo4j and Qdrant data retrieval issues,"Users experienced specific issues retrieving and filtering data from Neo4j graph databases and Qdrant vector stores in their AI systems. They needed help troubleshooting errors related to query formats, data filtering, and the overall retrieval functionality to get their expected results.",5,5,,"['help troubleshoot and fix issues with retrieving data from Neo4j and Qdrant databases. The user is encountering errors and needs assistance to get the data retrieval working correctly.', 'help troubleshoot and diagnose issues with the code and setup of the retrievers, including the Neo4j and Qdrant components, as well as the LangGraph node functions and state handling.', 'help with retrieving relevant data from Neo4j and Qdrant databases for marketing-related queries. The user is facing issues with the retrieval and filtering of the data.']"
9,Customize LangChain model configurations and base URLs,"Users wanted to customize the configuration of LangChain embedding and chat models, particularly focused on modifying base URLs and metadata. They specifically sought help with TypeScript implementations for third-party embedding models and updating configuration values while maintaining state.",5,5,,"[""update a single value in the configuration called 'github_url' to 'None' while also performing the normal actions of updating the state."", 'provide an example of how to integrate a third-party embedding model with a custom base URL in TypeScript, using the LangChain library.', 'learn how to inherit from the OpenAIEmbeddings class in TypeScript and add support for a custom base URL.']"
10,Configure and optimize LangChain tool calling and execution,"The group seeked help understanding and configuring tool usage in LangChain and LangGraph, including proper argument passing, tool selection, and invocation control. Users wanted to learn about tool definitions, binding tools to models, managing tool state, and tracing tool calls through LangSmith.",15,15,,"['help them understand how to properly configure a LangChain agent to pass arguments to tool functions with the correct data types, rather than as strings.', 'explain what a ""tool node"" is, which is a component in the LangChain ecosystem that allows language models to interact with external tools and APIs.', 'understand how to trace their use of LangChain and LangGraph in LangSmith, and whether they need to use the .invoke() method specifically or if there are other ways to enable tracing.']"
11,Debug and implement LangGraph state management and subgraphs,"Users were trying to understand and work with LangGraph's state management, graph execution, and subgraph functionality. They needed help accessing graph states, creating and calling subgraphs, handling long inputs, and debugging related code issues.",9,9,,"['understand how to access the state of a graph after invoking it, including both the immediate state after invocation and the saved state checkpoints if persistence is enabled.', 'transform the provided code and ensure that the graph fully completes all steps before retrieving the last message.', 'learn how to access and work with the state in a LangGraph application, including defining the state schema, accessing the state in node functions, and retrieving the updated state after graph execution.']"
12,Implement voice chat with audio detection and packet logging,"Users requested help implementing voice chat applications with specific technical requirements around audio input/output selection, voice activity detection, and packet logging. They wanted to distinguish between voice and noise, implement client-server functionality, and log connection details, often specifying they wanted to do this without external libraries.",7,7,,"['implement a voice chat application with the ability to select audio input and output devices, detect voice versus noise, and log relevant information about the voice packets and client connections.', 'help set up and integrate an MCP (Model Context Protocol) client within a FastAPI application, and to provide feedback and suggestions for improving the implementation.', 'help them implement a voice chat application with features like voice activity detection, packet logging, and client-side noise reduction, without using additional libraries.']"
13,Build engineering data QA system using knowledge graphs and natural language,"Users wanted to build an AI-powered question-answering system that could parse natural language queries about engineering data stored in a knowledge graph and convert them into executable Cypher queries. The system needed to handle multi-turn interactions, error cases, and return relevant information from the knowledge graph database.",9,9,,"['build an AI-powered engineering data question-answering system that can retrieve and summarize relevant information from a knowledge graph, and rewrite user questions into Cypher queries to search the graph.', ""implement a system that can answer questions about engineering data stored in a graph knowledge base, by extracting relevant information and rewriting the user's question into a query against the graph."", 'build an AI-powered system that can understand natural language queries, retrieve relevant information from a knowledge base, and generate code to access engineering data, with the ability to handle multiple rounds of interaction and provide results to the user.']"
